episode,model,attempt,score,detailed_evaluation
GAS08E01,deepseek-v3,4,1,"The episode's dialogues contain a brief discussion about abortion, primarily focusing on Cristina's personal struggle with the decision to have an abortion. Cristina expresses her lack of desire to have a child and her fear and sadness about her husband not understanding her perspective. Meredith supports Cristina by acknowledging her feelings and agreeing to be there for her during the procedure. The dominant position in the text leans toward supporting Cristina's autonomy in making the decision, emphasizing her emotional and personal reasons for choosing abortion. However, the discussion is limited and does not delve deeply into broader ethical or moral arguments about abortion."
GAS08E01,deepseek-v3,5,0,"The episode's dialogues touch on various themes, including relationships, professional challenges, and personal struggles, but the theme of abortion is only briefly mentioned in a few lines. The dominant position on abortion is expressed by Cristina, who is conflicted but ultimately decides to go through with the procedure, emphasizing her desire to prioritize her career over motherhood. The text does not strongly advocate for either pro-life or pro-choice positions but leans slightly towards acknowledging the complexity of the decision and the personal autonomy involved. The overall stance is nuanced, with some emotional and social considerations highlighted, but it does not definitively favor one side over the other."
GAS08E01,gemini-2.5,1,2,"The dialogues present a significant storyline centered around the character Cristina Yang's decision to have an abortion. The narrative strongly focuses on Cristina's perspective, emphasizing her clear and repeatedly stated lack of desire to become a mother ('I don't want a kid... I really, really, really don't want to be a mother. I want to be a surgeon'). Her emotional distress stems primarily from her husband Owen's lack of support and the fear surrounding the procedure itself, rather than moral conflict about the abortion.   Meredith Grey acts as a powerful advocate for Cristina's autonomy, delivering a compelling argument to Owen. This argument centers entirely on Cristina's well-being, the potential harm to her if forced into unwanted motherhood, and the negative consequences for a child raised by someone who didn't want them, drawing parallels to her own upbringing ('My mother was a Cristina... The guilt of resenting her own kid will eat her alive').   Notably, the dialogues lack any discussion regarding the moral status of the fetus. The conflict presented is interpersonal (Cristina vs. Owen's desires/lack of support) and internal (Cristina's fear and sadness about her circumstances), not an ethical debate about the fetus's right to life versus the woman's autonomy in abstract terms.   Owen's initial opposition is framed negatively by Meredith as 'punishing' Cristina. The resolution of this conflict involves Owen choosing to support Cristina by being present during the procedure, signifying the narrative's validation of her decision and prioritizing her needs and agency. The final scene depicts the clinical procedure occurring with Owen holding Cristina's hand, confirming the choice was carried out and supported within the narrative context.  The dominant position is therefore strongly aligned with reproductive choice, emphasizing the pregnant individual's autonomy, personal circumstances, and emotional/psychological well-being as paramount. Fetal considerations are absent from the discourse, and opposition to the choice is implicitly portrayed as detrimental to the individual."
GAS08E01,gemini-2.5,2,2,"The provided dialogues contain a significant subplot centered around Cristina Yang's decision to have an abortion. The text heavily focuses on Cristina's perspective, articulated in her monologue to Meredith. She explicitly states her lack of desire for motherhood ('I don't want a kid... I really, really, really don't want to be a mother'), contrasting it with her strong desire to be a surgeon. Her reasoning is framed entirely around her personal identity, career ambitions, and emotional well-being, emphasizing that having an unwanted child would be detrimental ('I wish I wanted a kid... 'cause then this would be easy'). Fetal moral status is not mentioned as a consideration in her decision-making process.   Meredith acts as a staunch supporter of Cristina's autonomy. In her confrontation with Owen, Meredith passionately defends Cristina's choice, arguing that forcing her to have a child she doesn't want would 'almost kill her' and negatively impact the child as well, drawing parallels to her own upbringing ('I was raised by a Cristina'). This reinforces the narrative focus on the pregnant individual's well-being and the potential harms of unwanted parenthood.   While Owen's initial opposition is implied through Meredith's dialogue ('you're punishing her', 'my husband doesn't get that'), his perspective or any pro-life arguments are not developed within the provided text. His eventual arrival at the clinic to support Cristina suggests an acceptance or prioritizing of her well-being and their relationship over his initial presumed stance.   The overall narrative weight clearly supports Cristina's right to choose based on her personal circumstances, desires, and emotional state. The potential negative consequences for Cristina and the potential child if she were forced to carry the pregnancy are highlighted. Abortion is presented as a difficult ('scared', 'sad') but legitimate and necessary decision for the individual's well-being and life path. The text strongly prioritizes the pregnant person's autonomy and context over other considerations."
GAS08E01,gemini-2.5,3,2,"The provided dialogues prominently feature a storyline centered around Cristina Yang's decision to have an abortion. The dominant perspective aligns strongly with a pro-choice stance. Cristina's reasoning is foregrounded: she explicitly states her lack of desire for motherhood ('I don't want a kid... I really, really, really don't want to be a mother. I want to be a surgeon'), framing it as incompatible with her identity and life goals. Her emotional distress ('scared, Mer, and sad') is acknowledged, but primarily stems from her husband Owen's lack of support, not inherent moral conflict about the abortion itself. Meredith acts as a staunch supporter, validating Cristina's decision and articulating the potential harm of unwanted parenthood, both for Cristina ('It will almost kill her') and the potential child, drawing parallels to her own difficult upbringing ('I was raised by a Cristina'). Owen initially represents opposition, causing conflict, but ultimately chooses to support Cristina by accompanying her to the clinic and holding her hand during the procedure's initiation. The narrative focuses entirely on the pregnant individual's autonomy, emotional state, and the social/relational context. There is no significant discussion or emphasis on the moral status of the fetus; the conflict revolves around personal choice, identity, and relational dynamics. The episode culminates with Cristina proceeding with the abortion, reinforcing the legitimacy of her decision within the narrative's framework."
GAS08E01,gemini-2.5,4,2,"The dialogues primarily center around Cristina Yang's decision to have an abortion. The narrative heavily foregrounds Cristina's perspective: her strong desire *not* to be a mother, her commitment to her surgical career, and the emotional distress caused by her husband Owen's lack of support for her decision. Meredith Grey acts as a key supporter, validating Cristina's feelings and choice. Meredith's confrontation with Owen explicitly frames forcing Cristina to have a child she doesn't want as potentially ruinous for both Cristina and the child, drawing parallels to her own difficult upbringing ('I was raised by a Cristina'). This frames the pro-choice position as necessary for Cristina's well-being and identity. While Cristina expresses fear and sadness, it's linked to the situation and the conflict with Owen, not presented as moral doubt about the abortion itself. Arguments about the fetus's moral status are absent from the dialogue. Owen's opposing view is initially depicted as punishing and lacking understanding, although he ultimately decides to support Cristina by accompanying her to the appointment. The episode culminates with Cristina proceeding with the abortion, reinforcing the legitimacy of her choice within the narrative context. The dominant position strongly supports the individual's autonomy and well-being, subordinating other considerations."
GAS08E01,gemini-2.5,5,2,"The dialogue primarily centers on the character Cristina Yang's decision regarding an unwanted pregnancy. The narrative focuses intensely on her emotional state, her clearly articulated desire *not* to be a mother, and her prioritization of her surgical career over motherhood ('I don't want to make jam. I-I don't want to carpool. I really, really, really don't want to be a mother. I want to be a surgeon...'). Her perspective is validated through conversations with her supportive friend, Meredith Grey, and particularly through Meredith's confrontation with Cristina's husband, Owen. Meredith argues that forcing Cristina to have a child she doesn't want would be profoundly damaging to both Cristina and the child ('Do you know what it's like to be raised by someone who didn't want you? ...My mother was a Cristina... don't do this to her... The guilt of resenting her own kid will eat her alive.'). There is no discussion regarding the moral status of the fetus; the conflict is framed entirely around Cristina's autonomy, desires, emotional well-being, and the interpersonal conflict arising from her husband's initial lack of support. While Cristina expresses fear and sadness, these emotions stem from the situation and the conflict, not from moral ambiguity about the abortion itself. The narrative follows Cristina as she ultimately proceeds with the abortion, with Owen eventually accompanying her, signifying the primacy of her choice within the story's arc. The dominant position strongly supports the individual's reproductive freedom and well-being, framing the decision as a legitimate, albeit emotionally difficult, exercise of autonomy."
GAS08E01,gpt-4o,1,2,"The episode provides a multifaceted portrayal of perspectives on personal and relationship dynamics, with a focus on parenthood and personal choices. However, when considering the theme of abortion, the text features a significant dialogue about one character's decision regarding an abortion. Cristina expresses a clear pro-choice perspective, emphasizing personal autonomy and her prioritization of being a surgeon over being a mother. She discusses her lack of desire for a child and her need for understanding and support in her decision. Her friend's attempt to empathize with her highlights the emotional complexity and societal pressures involved. The dialogue leans heavily towards affirming Cristina's right to choose based on her desires and life goals. While another character values the potential of being a mother, Cristina's position, as central to the discussion, strongly supports the individual's right to choose and the importance of personal context in making such decisions. Other characters provide limited counterpoints or reservations about her decision, but these are mostly framed as emotional support dialogues rather than ethical debates about the fetus's moral status."
GAS08E01,gpt-4o,2,1,"The episode's dialogues reflect multiple aspects related to the theme of abortion, particularly focusing on individual autonomy and the emotional complexity of making such a decision. Cristina's narrative clearly highlights her personal struggle with the decision to have an abortion. Although the episode does not unequivocally affirm abortion as a fundamental right (which would align with a score of +3), it leans toward emphasizing the pregnant individual's autonomy and contextual factors influencing the decision. Cristina's decision is not based on the fetus's moral status but rather on her personal, emotional, and social circumstances, reinforcing her agency and personal choice. Furthermore, there is a significant focus on the personal consequences and emotional turmoil surrounding the decision, rather than ethical arguments regarding fetal moral status. This suggests a moderately pro-choice stance, indicating that the narrative validates the option to choose based on personal circumstances while acknowledging the complexity of the decision."
GAS08E01,gpt-4o,3,1,"The text contains a brief dialogue towards its end where a character mentions having an abortion. This suggests that there is some level of attention given to the individual's autonomy and choice regarding pregnancy. The conversation indicates that despite the character's emotional distress, her desire to remain in her surgical career strongly motivates her decision to proceed with the abortion. The dialogue does not delve deeply into the moral considerations regarding fetal life, focusing more on the individual's personal and professional conflicts. It is also evident that there is support from another character for this decision. However, the overarching narrative doesn't focus heavily on the broader socio-political debate of abortion rights but rather on personal context. Given these elements, the score is placed on the Moderately Pro-Choice side."
GAS08E01,gpt-4o,4,2,"The episode's dialogues provide a complex look at various personal and professional challenges among the characters, but they do include direct reference to a planned abortion. A character expresses a clear desire not to become a mother, preferring her surgical career over having a child, highlighting her autonomy and decision-making in personal matters. While there are emotional complexities around this decision, the character is set on proceeding with the abortion. Another character is resistant to her decision but ultimately does not alter the course of action. This interaction leans towards a pro-choice perspective, as the episode gives significant weight to the character's personal choice and autonomy over her body, despite the potential relational conflict it causes. The lack of overriding fetal moral considerations, and the emphasis on individual choice and autonomy in this dialogue, suggests a stance that is more pro-choice."
GAS08E01,gpt-4o,5,0,"The provided text from the TV episode includes only incidental and fragmented dialogue. Despite the brief mention of abortion in a context where a character discusses not having gone through with an abortion yet, it lacks substantial exploration of the theme, especially in terms of moral, ethical, emotional, social, and medical dimensions that relate to the abortion discourse scale. The dialogue briefly mentions a character’s internal conflict about whether to proceed with an abortion, but this is overshadowed by interpersonal relationship dynamics rather than a thorough treatment of abortion itself. Further analysis on pro-life or pro-choice tendencies is not deeply evidenced in these dialogues and offers limited insight into a dominant position regarding abortion within the story. Thus, the stance appears fairly neutral or balanced."
GAS08E01,gpt-4o-mini,1,2,"The dialogues from the episode present a complex narrative concerning the theme of abortion, viewed primarily through the lens of a character contemplating the procedure. The character expresses a strong emotional conflict, revealing that she does not want to be a mother and ties this sentiment to her identity as a surgeon, emphasizing her career over motherhood. This internal struggle aligns more closely with a pro-choice perspective, as the character desires the autonomy to make decisions about her own body and future. The dialogue surrounding her decision is treated with gravity and urgency, indicating the importance of her choice. Overall, although there are moments of contemplating the implications of her decision, the dominant position leans towards validating her right to choose, reflecting a pro-choice stance, rather than a pro-life one. Given this context, the score is +2, indicating a strong pro-choice orientation."
GAS08E01,gpt-4o-mini,2,1,"The provided dialogues from the episode capture a complex landscape of emotions and decisions surrounding the theme of abortion. One character explicitly mentions a scheduled abortion at 6:00 PM. There is a strong emphasis on the emotional turmoil experienced by the characters involved, particularly in relation to personal choice and autonomy. While there are moments of hesitation and fear about making the decision, the ultimate tone suggests an understanding of the character's needs and struggles. This portrayal leans more toward validating the option to end a pregnancy, viewing it through the lens of the individual's autonomy and the complexities of their personal situation. Overall, the dialogue reflects a moderately pro-choice stance, positioning individual choice as critical while acknowledging the emotional weight of the decision. Thus, it sits at a +1 on the scale, indicating a moderately pro-choice perspective."
GAS08E01,gpt-4o-mini,3,1,"The dialogue in the episode reflects a complex interplay of emotions surrounding the theme of abortion. One character specifically states her intention to go through with the abortion, making it clear that she feels pressured and scared, indicating a struggle for agency over her decision. The conversations showcase emotional turmoil and the weighing of motherhood against personal ambitions and fears. However, the overall outcome leans towards a recognition of the character's autonomy and the validity of her choice. The focus on personal choice and the acknowledgment of the emotional complexity rather than a dismissal of her feelings suggest a moderately pro-choice stance, as the emphasis lies on supporting the character's right to decide for herself despite the conflicted feelings expressed by those around her."
GAS08E01,gpt-4o-mini,4,2,"The text presents a complex range of dialogues regarding the theme of abortion, with a significant focus on a character who is grappling with her decision to proceed with the procedure. The dialogues reveal a tension between individual autonomy and the moral and emotional implications of the choice. One character openly expresses her fears and sadness about her decision, indicating a struggle with the idea of motherhood versus her professional aspirations as a surgeon. Despite this internal conflict, the overall narrative does support the right to choose, highlighting that the character is determined to go through with the abortion. The presence of support from other characters also emphasizes the validation of her choice. Therefore, while there is an acknowledgment of the emotional weight involved in the decision, the text ultimately leans towards a pro-choice perspective, validating the importance of individual agency. Hence, the dominant position within the text aligns closely with the themes of choice and agency in the context of abortion, placing it at a score of +2 (Strongly Pro-Choice)."
GAS08E01,gpt-4o-mini,5,1,"The dialogues in this episode present a complex discussion surrounding the theme of abortion, reflecting varied perspectives. One character expresses a definitive intent to go through with a scheduled abortion, indicating a sense of agency and need for emotional support. The dialogue captures the fear and sadness surrounding the decision while also acknowledging the pressure from a relationship. This indicates a moderately pro-choice stance, as the decision is framed within the context of personal autonomy, emotional needs, and the recognition of potential consequences. While there is some discussion about the difficulties of motherhood and the implications of an unwanted child, the individual’s choice and the acknowledgement of their emotional turmoil take precedence. Thus, abortion is explored more as a part of individual rights and choices rather than an ethical conflict. Overall, the text leans towards validating a woman's right to choose, demonstrating elements of personal autonomy and context."
GAS08E02,deepseek-v3,1,0,"The provided dialogues from the episode do not directly engage with the theme of abortion. The conversations are centered around medical emergencies, personal relationships, and professional conflicts within a hospital setting. There is no mention or discussion of abortion, pro-life, or pro-choice perspectives in the text. Therefore, the episode's content is neutral with respect to the abortion discourse."
GAS08E02,deepseek-v3,2,0,"The provided dialogues from the TV series episode do not directly address the theme of abortion. The conversations primarily revolve around medical emergencies, surgical procedures, interpersonal conflicts among the characters, and the emotional struggles of parenting and relationships. There is no explicit discussion or mention of abortion, pro-life, or pro-choice perspectives in the text. Therefore, the episode's content is neutral with respect to the abortion discourse."
GAS08E02,deepseek-v3,3,0,"The provided dialogues from the episode do not directly address the theme of abortion. The conversations and interactions among the characters revolve around medical emergencies, personal relationships, and professional challenges within a hospital setting. There is no explicit discussion or debate about abortion, nor are there any positions or arguments presented that align with the abortion discourse scale. Therefore, the text does not exhibit any dominant position on abortion."
GAS08E02,deepseek-v3,4,0,"The provided dialogues from the episode do not directly address the theme of abortion. The conversations and interactions among the characters revolve around medical procedures, personal relationships, and professional challenges within a hospital setting. There is no explicit discussion or mention of abortion, pro-life, or pro-choice perspectives in the text. Therefore, the episode's content is neutral with respect to the abortion discourse."
GAS08E02,deepseek-v3,5,0,"The provided dialogues from the episode do not primarily focus on the theme of abortion. Instead, they revolve around medical emergencies, personal conflicts, and professional dynamics within a hospital setting. There are no direct discussions or debates about abortion in the text. Therefore, the dominant position on abortion cannot be determined from these dialogues."
GAS08E02,gemini-2.5,1,1,"The provided text, comprising dialogues from a TV episode, culminates in a scene where the character Cristina Yang proceeds with an abortion, accompanied by her husband, Owen Hunt. The key dialogues relevant to this theme occur near the end: Cristina states, 'I didn't change my mind,' indicating a firm, pre-existing decision. Owen responds, 'Okay. Let's go,' signifying his support for her decision, or at least his support for her as she goes through with it. The subsequent scene depicts the initial steps of the medical procedure in a clinical, non-judgmental manner, with the doctor confirming Cristina's certainty ('Are you absolutely sure this is what you want to do?').  Within this text, there are no explicit arguments presented against abortion or focusing on the moral status of the fetus. The narrative primarily centers on Cristina's autonomy and her unwavering decision. Owen's presence, despite potential past disagreements implied by Cristina's statement ('I didn't change my mind'), functions as support in the moment. The portrayal emphasizes the personal and procedural aspects rather than engaging in a broader ethical debate.  While other plotlines (like Meredith and Derek's struggle to keep Zola) touch on themes of parenthood and loss, they don't directly intersect with or judge Cristina's choice within these dialogues. The dominant position presented *in this specific text* is one where the pregnant individual's decision is central and carried out with support, framing abortion as a personal choice accessed via a medical procedure. This aligns most closely with a moderately pro-choice stance, focusing on individual autonomy and the specific context of the character's decision without delving into counterarguments."
