episode,model,attempt,score,detailed_evaluation
GDS04E06,deepseek-v3,1,2,"The episode features a range of perspectives on abortion, but the dominant narrative supports the pregnant individual's autonomy in making the decision. The characters engage in discussions that acknowledge the moral and emotional complexities of abortion, but ultimately, the text leans toward validating the individual's choice. Dr. Lim's insistence that residents must be trained to perform abortions, regardless of personal beliefs, underscores the institutional support for reproductive rights. Additionally, the portrayal of the patient's fear and the reassurance she receives from her doctors further emphasizes the pro-choice orientation of the text. While there are dissenting voices, such as the resident's religious objections, these are presented as individual conflicts rather than overarching moral imperatives."
GDS04E06,deepseek-v3,2,1,"The episode presents a nuanced view on abortion, primarily through the dialogue involving Dr. Lim, Jordan, and the patient seeking an abortion. The text acknowledges the patient's autonomy and emotional state, with Dr. Lim supporting the patient's decision and ensuring she receives proper care. However, it also includes Jordan's personal conflict due to her religious beliefs, which adds a pro-life perspective. The dominant position leans towards supporting the patient's choice, emphasizing medical care and emotional support, but it does not dismiss the moral complexities entirely. The narrative does not overwhelmingly advocate for one side but provides a balanced view with a slight inclination towards pro-choice, given the focus on the patient's well-being and autonomy."
GDS04E06,deepseek-v3,3,1,"The episode presents a nuanced view on abortion, primarily through the storyline involving a resident, Jordan, who is conflicted about performing an abortion due to her religious beliefs. The narrative acknowledges the ethical and emotional complexities surrounding abortion, including the pregnant individual's autonomy and the medical necessity of the procedure. The dominant position leans towards pro-choice, as the text emphasizes the importance of medical professionals being able to perform abortions when necessary, despite personal beliefs. However, it also respects the moral dilemmas faced by individuals, providing a balanced yet slightly pro-choice perspective."
GDS04E06,deepseek-v3,4,1,"The episode presents a nuanced view on abortion, primarily through the dialogue involving Dr. Lim, Jordan, and the patient seeking an abortion. The text acknowledges the patient's autonomy and emotional state, with Dr. Lim supporting the patient's decision and ensuring she receives proper care. However, it also includes Jordan's personal conflict due to her religious beliefs, which adds a pro-life perspective. The dominant position leans towards supporting the patient's choice, emphasizing medical care and emotional support, but it does not dismiss the moral complexities entirely. The narrative does not overwhelmingly advocate for one side but provides a balanced view with a slight inclination towards pro-choice, given the focus on the patient's well-being and autonomy."
GDS04E06,deepseek-v3,5,1,"The episode presents a nuanced view on abortion, primarily through the dialogue involving Dr. Lim, Jordan, and the patient seeking an abortion. The text acknowledges the patient's autonomy and emotional state, with Dr. Lim supporting the patient's decision and ensuring she receives proper care. However, it also includes Jordan's personal conflict due to her religious beliefs, which adds a pro-life perspective. The dominant position leans towards supporting the patient's choice, emphasizing medical care and emotional support, but it does not dismiss the moral complexities entirely. The narrative does not overwhelmingly advocate for one side but provides a balanced view with a slight inclination towards pro-choice, given the focus on the patient's well-being and autonomy."
GDS04E06,gemini-2.5,1,2,"The dialogues present a scenario where a patient seeks an abortion for personal reasons ('Apparently not a happy surprise'). The medical justification for involving surgery is her underlying health condition requiring careful post-procedural monitoring, not the abortion itself. The core conflict surrounding the abortion theme arises from Resident Jordan Allen's religious objection ('I'm a Christian. Performing an abortion goes against my beliefs.') versus the professional requirements articulated by Dr. Lim ('It's my job to make sure you can perform all surgeries, including abortions.') and the patient's needs emphasized by Dr. Andrews ('She's facing an emotionally fraught procedure. She needs the support of her doctors... a rookie who thinks she's committing murder.').   While Jordan's 'pro-life' leaning viewpoint is explicitly stated and explored (including her own past abortion which complicates her stance), the narrative's dominant position, driven by Dr. Lim and reinforced by Dr. Andrews' concerns, strongly prioritizes the patient's autonomy and well-being. Dr. Lim directly affirms the patient's choice ('Are you certain you wanna go ahead...? Yes. Then you don't have to be scared. You're the making the right decision for you.'). Jordan's hesitation during the procedure is framed not as a valid moral stand within that context, but as a professional failing that negatively impacts the patient ('you took on an obligation to that patient, and you failed her.'). The abortion itself is treated as a legitimate medical procedure that the hospital and its surgeons are obligated to provide safely and supportively once the patient has chosen it. The focus is on the patient's right to choose and receive care, and the doctors' professional responsibility, rather than a debate on the fetus's moral status. Jordan's internal conflict and past are acknowledged, adding nuance, but do not shift the narrative's core validation of the patient's decision. Therefore, the dominant position strongly supports reproductive choice and patient autonomy."
GDS04E06,gemini-2.5,2,2,"The episode presents the topic of abortion primarily through the lens of medical professionalism, patient care, and personal conflict rather than a purely ethical debate on fetal rights. A patient requires an abortion and, due to her medical history, needs it performed in a surgical setting with close observation. The narrative introduces conflict through Dr. Jordan Allen, a resident whose Christian beliefs oppose abortion. However, this opposition is juxtaposed against the Chief of Surgery, Dr. Lim's, stance that performing all necessary procedures, including abortion (especially in life-saving contexts), is a core professional duty. Dr. Lim initially allows Jordan to proceed under supervision but ultimately prioritizes the patient's emotional comfort and procedural success over Jordan's forced participation when Jordan shows distress during the D&C. Dr. Lim's interaction with the patient is markedly supportive, affirming her choice ('You're making the right decision for you') and prioritizing her emotional state. Furthermore, Dr. Park voices concern for the patient's emotional experience, arguing against assigning a doctor who fundamentally opposes the procedure. The narrative's resolution involves Jordan revealing her own past abortion, undertaken for career reasons, which she states she does not regret, adding complexity to her initial 'pro-life' stance and reframing her difficulty as perhaps stemming more from personal trauma and conflict than purely abstract religious doctrine. The overarching message conveyed by the senior staff and the narrative's focus is on the patient's autonomy, the importance of supportive care during a vulnerable procedure, and the professional obligations of surgeons. While Jordan's perspective is presented, it is ultimately framed as a personal challenge she needs to manage to fulfill her professional duties, and her own history complicates a simple 'pro-life' categorization. The dominant position within the text strongly prioritizes the patient's choice, well-being, and the medical necessity/professional duty aspect, subordinating the religious/moral objections raised."
GDS04E06,gemini-2.5,3,1,"The episode presents abortion primarily through the lens of professional medical ethics and patient care, rather than engaging in a deep debate about the morality of abortion itself. The central conflict revolves around Dr. Jordan Allen, a resident whose Christian beliefs conflict with performing an abortion (a D&C procedure), and Dr. Lim, the Chief of Surgery, who insists it's a required part of the job.  Several viewpoints are presented: 1.  **The Patient:** Clearly wants the abortion, expresses fear, and needs reassurance. Her decision is presented as valid and is not questioned by senior staff. 2.  **Dr. Jordan Allen:** Initially refuses based on religious beliefs but agrees under pressure from Dr. Lim. Her internal conflict negatively impacts the patient during the procedure. Later, she reveals she had an abortion herself, chose her career, doesn't regret it, and reconciles it with her faith, adding significant complexity to her initial 'pro-life' stance. Her objection shifts from a purely moral one to a deeply personal, perhaps unresolved, one. 3.  **Dr. Audrey Lim:** Prioritizes professional duty and competence, insisting residents must learn all necessary procedures, including abortion, regardless of personal beliefs. While initially appearing harsh, she takes over the procedure when Jordan falters, indicating a priority for the patient's immediate well-being in that critical moment. Her stance is functionally pro-access within the hospital training context. 4.  **Dr. Claire Browne & Dr. Alex Park:** Express concern about assigning a conflicted resident (Jordan) to the patient, emphasizing the patient's emotional vulnerability and need for supportive care. They implicitly advocate for prioritizing the patient's experience. 5.  **Dr. Shaun Murphy:** Views the procedure and teaching responsibility primarily through a technical and procedural lens, detached from the moral debate.  The narrative arc criticizes Jordan not for her beliefs, but for letting her conflict compromise patient care ('You failed her'). Claire reassures the patient ('You're making the right decision for you'), validating her choice. While Jordan's conflict provides drama, the episode doesn't validate the 'abortion is murder' viewpoint; instead, it frames it as a personal struggle that must not interfere with professional duties or harm the patient. The dominant position emerging from the interactions and consequences depicted centers on the patient's autonomy, the necessity of abortion provision as a medical service, and the professional obligation to provide care, even if it requires navigating personal conflicts. The focus remains largely on the pregnant person's choice and experience, and the professional dynamics surrounding it, rather than the moral status of the fetus. This aligns with a moderately pro-choice framing."
GDS04E06,gemini-2.5,4,1,"The dialogues present a scenario where a patient requests an abortion, which is framed as a standard medical request ('24-year-old woman... she's pregnant. Apparently not a happy surprise. She wants an abortion.'). The primary conflict arises not from questioning the patient's decision, but from a resident's (Dr. Jordan Allen) religious objection to performing the procedure ('I'm a Christian. Performing an abortion goes against my beliefs.').  The text explores the tension between personal beliefs and professional medical obligations. Characters like Dr. Lim and Dr. Andrews emphasize the importance of residents learning necessary procedures and providing non-judgmental, supportive care to the patient, positioning the patient's well-being and emotional state as paramount during a sensitive time ('She's facing an emotionally fraught procedure. She needs the support of her doctors.'). Dr. Shaun Murphy reassures the patient directly ('You're making the right decision for you.').  Dr. Allen's internal conflict is given significant attention, including a later reveal of her own past abortion ('I chose my career over motherhood, over my faith. But I don't regret it.'), adding complexity to her character beyond a simple 'pro-life' stance. However, her hesitation during the procedure is strongly condemned by Dr. Lim as a professional failure that harmed the patient ('You have no idea what that woman was going through, and you made it worse for her... you took on an obligation to that patient, and you failed her.').  While the 'pro-life' perspective is represented through Dr. Allen's initial refusal and ongoing discomfort, the narrative's dominant focus is on the patient's choice being respected and the necessity for doctors to provide appropriate care without imposing personal judgments. The negative framing of Dr. Allen's actions during the procedure underscores the priority given to the patient's experience and autonomy in this context. The ethical arguments regarding fetal moral status are implied through Allen's conflict but are not explicitly debated or centered. The overarching message aligns with ensuring access to the procedure and professional conduct from medical staff, leaning towards validating the patient's choice within the medical system."
GDS04E06,gemini-2.5,5,2,"The episode introduces the abortion storyline through a patient who desires one due to both personal choice ('Apparently not a happy surprise. She wants an abortion.') and medical necessity (congenital IgA deficiency requiring post-surgical observation). The central conflict surrounding the abortion doesn't question the patient's decision but revolves around Dr. Jordan Allen's religious objection ('I'm a Christian. Performing an abortion goes against my beliefs.') versus the professional requirement to perform the procedure, enforced by Dr. Lim ('it's my job to make sure you can perform all surgeries, including abortions.'). Dr. Lim frames abortion as a necessary medical skill, potentially life-saving in other contexts, prioritizing professional duty and patient access. Dr. Andrews shifts focus to the patient's emotional state, arguing against having a conflicted resident perform such a 'fraught procedure,' thereby centering the patient's experience. Crucially, when interacting directly with the patient, Dr. Lim explicitly validates her choice, offering reassurance: 'Are you certain you wanna go ahead with the abortion? Yes. Then you don't have to be scared. You're the making the right decision for you.' This direct validation strongly supports the patient's autonomy. During the procedure, Jordan's visible distress prompts Lim to take over, prioritizing the patient's immediate well-being. Jordan later reveals her own past abortion, which she chose for her career and does not regret, adding complexity but ultimately suggesting personal acceptance of abortion as a valid, albeit difficult, choice under certain circumstances. The narrative avoids delving into the moral status of the fetus; the discourse focuses on the patient's choice, medical factors, professional obligations, and the emotional impact on both patient and provider. The dominant position, primarily represented by Dr. Lim's actions and words, and supported by the narrative's focus, portrays abortion as a legitimate medical procedure and affirms the patient's right to make that choice for herself. The religious objection is presented but ultimately subordinated to professional duty and patient care."
GDS04E06,gpt-4o,1,1,"The episode presents various perspectives on abortion through dialogue, with a particular focus on a 24-year-old woman seeking an abortion due to a congenital IgA deficiency and a history of severe infections. The narrative acknowledges the individual's emotional and medical context for considering abortion, emphasizing personal autonomy—the right to make decisions based on one's health and individual circumstances. While the character Jordan expresses initial reluctance due to her religious beliefs, she eventually participates, reinforcing the importance of medical training and professional duty. Additional characters suggest empathy and support for the woman, appreciating the challenges of the decision. The episode does not frame the fetus's moral status as an absolute imperative; rather, it provides a space for women’s autonomy and medical or emotional reasons to take precedence. This context indicates a moderately pro-choice stance. Fetal considerations are acknowledged, but the emphasis remains on the individual’s circumstance and rights."
GDS04E06,gpt-4o,2,1,"The episode 'The Good Doctor' presents multiple perspectives on the topic of abortion, primarily through the interactions of different medical professionals and their personal beliefs. The dialogue involves a medical doctor who is hesitant to perform an abortion due to her Christian pro-life beliefs, expressing strong discomfort and moral conflict with participating in the procedure. However, she is eventually persuaded to proceed to ensure she is equipped for situations where it may be medically necessary to save a life. Another doctor, reflecting a professional duty over personal beliefs, firmly asserts the need to perform all types of surgeries, including abortions. The dominant theme here portrays the complexity and pressure medical professionals face in balancing personal beliefs and professional obligations. Despite instances of personal conviction against abortion, the professional and medical necessity outweighs these views, as characters accept their roles in performing the procedure when required by context. This reflects a moderate stance towards respecting a woman's choice and the medical necessity for abortion while acknowledging differing personal beliefs. Overall, the text leans towards a moderate pro-choice position, focusing on the importance of professional duties and personal autonomy in the context of abortion, without dismissing different personal convictions."
GDS04E06,gpt-4o,3,1,"The episode includes a brief yet significant dialogue about abortion. A pregnant woman comes to the ER and requests an abortion due to underlying medical conditions. This scenario touches on both the woman's autonomy in making a choice for her health and the potential life of the fetus. The dialogue progresses with Dr. Murphy initially struggling with his role in teaching the procedure and Dr. Allen (Jordan) expressing her Christian beliefs against performing abortions. Despite her beliefs, she acknowledges the importance of learning the procedure, indicating a personal conflict between her faith and professional responsibilities. Another doctor expresses concern that Jordan's belief could negatively impact the patient's experience. The conversation centers more on Jordan's growth and understanding that as a doctor, she needs to provide all aspects of care. Solutions and support for the woman's decision are emphasized over any significant moral arguments about the fetus. Emotional and contextual complexities of both the patient and the resident showcase a leaning towards understanding and respecting the woman's choice. Given these factors, the dominant position in the text aligns with the 'Moderately Pro-Choice' stance, as it supports the autonomy of the pregnant individual while still recognizing different perspectives."
GDS04E06,gpt-4o,4,0,"The episode dialogues you've provided give insight into multiple perspectives on abortion. Several characters express positions directly tied to the topic. Dr. Murphy is faced with the task of teaching a surgical procedure related to abortion and is challenged by another character who identifies as Christian, expressing discomfort due to religious beliefs. This highlights a nuanced viewpoint that navigates both personal beliefs and professional obligations. Eventually, the resident Jordan decides to learn the procedure, reflecting a shift toward accepting necessary medical procedures despite conflicting personal values. Additionally, the surgical team shows support for the autonomy of the patient undergoing the procedure by ensuring her comfort and understanding during her experience. The spectrum of opinions presented shows an inclination towards validating the choice to undergo abortion, despite some initial resistance based on personal or religious values. The episode reflects a mixed stance, acknowledging the complexity of personal belief systems while underscoring the importance of medical education and patient autonomy."
GDS04E06,gpt-4o,5,1,"The episode of 'The Good Doctor' presents a complex and multi-layered view of abortion. Various characters express differing views, with one explicitly stating a religious objection to performing abortions. This character displays a struggle between personal beliefs and professional responsibilities, highlighting the tension between private morals and medical duties. Another character takes over the procedure due to the first character's reluctance and inexperience, indicating institutional prioritization of patient care over personal beliefs in urgent cases. Another character empathically reassures a patient seeking an abortion, supporting her decision and emphasizing the importance of personal choice. Overall, while the moral value of the fetus is acknowledged through a character's objection, the narrative gives more attention to the medical and personal autonomy aspects, ultimately supporting the pregnant individual’s right to choose. This places the episode closer to a pro-choice stance."
GDS04E06,gpt-4o-mini,1,1,"The dialogues depict a nuanced discussion around abortion, where some characters express personal beliefs and ethical concerns about performing the procedure. Dr. Murphy initially indicates discomfort with abortion due to his Christian beliefs, suggesting a pro-life stance, but ultimately resolves to perform the procedure when recognizing its importance in a medical context. The patient expresses fear but ultimately confirms her decision to proceed with the abortion, emphasizing her autonomy. The discussion suggests that while some characters have strong personal convictions against abortion, the narrative ultimately presents the choice of the patient at the forefront, hinting at a more pro-choice sentiment as it unfolds. Overall, the text balances the internal conflict between personal beliefs and professional responsibilities while positioning the woman's choice as central. This analysis leans towards a moderately pro-choice stance but does acknowledge the complexities and challenges involved in the decision-making process regarding abortion."
GDS04E06,gpt-4o-mini,2,1,"The dialogues from this episode of 'The Good Doctor' include discussions surrounding a patient who wants an abortion. The characters express various personal beliefs, including the character who is a Christian and opposes performing abortions. However, throughout the episode, there's a notable push towards recognizing the patient's autonomy and the legitimacy of her choice. At one point, a character expresses that the patient should not feel scared and is making the right decision for herself, indicating support for her choice. The overarching narrative realizes that the surgeon's personal beliefs cannot impede the patient's right to make decisions regarding her healthcare. Overall, the dialog represents a nuanced exploration of abortion, maintaining a pro-choice perspective while wrestling with individual ethical concerns. Thus, the dominant position within this text aligns more closely with a moderately pro-choice stance (+1)."
GDS04E06,gpt-4o-mini,3,1,"The dialogues from the episode reveal a complex landscape of attitudes toward abortion among the characters. Dr. Murphy demonstrates a willingness to perform a D&C despite his personal reservations and religious beliefs, as he understands the necessity of the procedure for the patient's health and emotional state. This implies a recognition of the legitimacy of abortion, albeit reluctantly. Conversely, Dr. Lim directly confronts the ethical dilemmas that arise when personal beliefs interfere with professional responsibilities, emphasizing the importance of patient care over individual convictions. The dialogue acknowledges the emotional turmoil of the patient considering an abortion, framing it as a decision made for her own well-being. However, there is also an undercurrent of conflict regarding the moral implications of abortion, particularly highlighted by the character's discomfort with the procedure. Overall, while there are strong representations of both pro-choice perspectives and pro-life arguments, the dominant position leans towards affirming the patient's choice, situating this episode closer to a moderate pro-choice stance, as the characters emphasize respect for the individual's decision."
