episode,model,attempt,score,detailed_evaluation
ERS04E19,gpt-4o,4,0,"The episode portrays a complex and nuanced discourse on abortion. It includes various perspectives, emphasizing both the challenges faced by individuals considering or involved in abortion procedures and the broader societal pressures and consequences. On one hand, the bombing of a reproductive center and the subsequent chaos highlight the more extreme 'pro-life' actions taken to prevent abortion, potentially associating violence with anti-abortion sentiments. Dynamics within the hospital show medical professionals grappling with the ethics of abortion - whether it's the aftermath of incomplete abortion or the struggle with moral implications during a procedure. Characters express personal discomfort and moral uncertainty when dealing with late-stage abortions, reflecting a conflict between medical responsibility and personal beliefs. The dialogue advocates for the recognition of autonomous patient choices, yet acknowledges the emotional weight such decisions carry. The legal discourse surrounding the decision-making authority for a minor's pregnancy also represents societal conflicts regarding bodily autonomy versus parental rights. The predominant stance in the episode skews towards a 'neutral/balanced' presentation of abortion discourse, characterized by an exploration of different angles without a definitive lean towards pro-life or pro-choice stances."
ERS04E19,gpt-4o,5,0,"The episode touches on the theme of abortion primarily through the storyline involving a bombing at a reproductive health center that provides both prenatal care and abortion services. The text presents a variety of viewpoints on abortion, reflecting a spectrum of opinions. On one hand, the dialogue from protesters and discussions about the ethics and morality of abortion implies a pro-life stance, as exemplified by a protester equating abortion to genocide and encouraging violence against abortion providers. On the other hand, the characters in the hospital demonstrate professionalism and are focused on patient care, including performing necessary medical procedures regardless of personal beliefs. There is also a conversation between two doctors about the moral challenges of performing abortions, indicating a nuanced perspective. Overall, while there are strong negative sentiments towards abortion through the protesters, the episode also emphasizes the importance of patient autonomy and the professionals’ obligations to provide medical care. Thus, the dominant position in this episode does not strongly favor either extreme, but rather acknowledges both sides, while leaning slightly towards respecting patient choices in complex scenarios."
ERS04E19,gpt-4o-mini,1,1,"The episode presents a complex dialogue regarding abortion, addressing a range of emotions and medical considerations. Key moments include the tension between the necessity of performing an abortion due to medical complications and the personal feelings of the medical staff involved in the procedure. Notably, a resident expresses a moral conflict regarding completing an abortion, indicating discomfort when the fetus is further along in pregnancy. The medical team also displays differing views on the ethics of abortion, reflecting on the complexities involved in such decisions. There are discussions about a patient whose conditions elicit a debate about saving her life versus preserving the fetus, showing emotional distress and opposing perspectives within the healthcare team. Despite these personal conflicts, there is a clear recognition of the importance of a patient's autonomy and the necessity for medical action based on their health needs. Overall, while there are characters that express pro-life sentiments, the episode maintains a strong emphasis on the pregnant individuals' circumstances, their autonomy, and the medical realities they face, consistently lending support to the option of abortion when indicated. Given the weight of individual choice and acknowledging the difficult circumstances surrounding the cases presented, the text leans towards a score that reflects moderate support for reproductive autonomy and the complexities involved in making such decisions."
ERS04E19,gpt-4o-mini,2,1,"The episode features a range of dialogues surrounding the theme of abortion, including medical emergencies connected to abortion procedures, personal conflicts among medical staff regarding their views on abortion, and the emotional turmoil of the characters involved. The dominant position presented leans towards a pro-choice perspective, with a significant emphasis on the autonomy of the individuals involved. The characters discuss the difficult circumstances surrounding a patient's abortion and the complications that arise, indicating a recognition of the necessity and legitimacy of abortions in certain contexts, particularly in cases where the health of the mother is at risk. The ethical dilemmas among the doctors show a deep consideration of the individual's right to choose. Although there are different opinions expressed about the emotional weight of abortion, the overall framing supports understanding and compassion for the choices made by individuals, thus highlighting personal autonomy primarily. Therefore, the overall alignment is moderately pro-choice, aiming to affirm the rights and decisions of the patients more than focusing solely on fetal moral status."
ERS04E19,gpt-4o-mini,3,1,"The dialogues express a range of perspectives on abortion, particularly highlighting the emotional and ethical complexities involved in the decision to terminate a pregnancy. Key moments include the character's struggles with completing an abortion despite the medical need, reflecting an internal conflict that suggests a hesitation tied to personal beliefs. The presence of characters who are explicitly in support of abortion rights, alongside those who express discomfort with the procedure, contributes to a balanced portrayal of the issue. Given the overall tone that acknowledges the challenges surrounding abortion without framing it as morally unacceptable, the text suggests a moderate endorsement of individual autonomy while recognizing the nuanced nature of such decisions. Thus, it falls on the moderately pro-choice side of the scale, reflecting an understanding of the social and emotional factors at play while supporting the right to choose."
ERS04E19,gpt-4o-mini,4,-2,"The dialogues from this episode of ER present a complex and varied discussion about abortion. Multiple characters express a range of positions, reflecting both pro-life and pro-choice sentiments. However, a significant moment occurs when the character faces personal turmoil over a late-term abortion due to emotional complications, indicating a struggle with the moral implications of their actions. This suggests a strong pro-life perspective, as concern for the fetus's potential life is weighed heavily against the mother's circumstances. The dialogue also highlights instances where characters express discomfort with the procedure under specific circumstances, indicating moral objections to abortion when it comes to viability. Additionally, there are characters and moments that advocate for reproductive rights, but these are often overshadowed by the emotional and moral weight of the choices being discussed. Overall, while there are voices on both sides, the overarching tone leans more toward the pro-life sentiment, making the text's dominant position a -2, as it acknowledges but downplays pro-choice arguments in favor of fetal rights and emotional turmoil over abortion decisions."
ERS04E19,gpt-4o-mini,5,1,"The dialogues from this episode of ER explore a complex range of perspectives surrounding abortion, particularly through the emergency situations that arise following a bombing at a clinic. Characters express strong emotions and conflicts related to the ethics of abortion, balancing the rights of the fetus with the medical and emotional circumstances of the mothers involved. The scene where an attending physician pressures a resident to perform an abortion despite her moral objections illustrates the tension between personal beliefs and professional duties. Overall, there is a recognition of the difficult choices individuals face, including the emotional suffering they endure. While the episode acknowledges the personhood of the fetus, it equally prioritizes the autonomy and context of pregnant individuals, ultimately leaning towards a moderate nuance in favor of choice. Thus, the dominant position within the text leans toward validating the complicated context in which abortion occurs, aligning more closely with a pro-choice perspective but without fully negating the pro-life sentiment. Hence, the overall score can be considered +1, indicating a moderately pro-choice stance with space for compassion for those on both sides of the debate."
ERS05E07,deepseek-v3,1,0,"The provided dialogue from the episode of ER does not contain any explicit discussions or debates about abortion. The medical scenarios and interpersonal interactions focus on various other medical and personal issues, but abortion is not a theme that emerges in the provided text. Therefore, the dialogue does not align with any position on the abortion discourse scale."
ERS05E07,deepseek-v3,2,0,"The provided dialogues from the ER episode do not contain any direct or substantial discussion on the theme of abortion. While there is a brief mention of a character having had two abortions in their medical history, this is not explored in depth or debated among characters. The episode's focus is primarily on other medical and interpersonal issues, with no dominant position or discourse on abortion presented. Therefore, the text does not align strongly with either pro-life or pro-choice perspectives."
ERS05E07,deepseek-v3,3,0,"The provided dialogues from the ER episode do not contain any direct or substantial discussion about abortion. The interactions and medical cases presented focus on various other medical and personal issues, but abortion is not a theme that is addressed or explored in the given text. Therefore, the text does not align with any position on the abortion discourse scale."
ERS05E07,deepseek-v3,4,0,"The provided dialogues from the episode of ER do not contain any direct or substantial discussion about abortion. The conversations revolve around various medical cases, interpersonal dynamics among the staff, and personal issues, but there is no mention or exploration of the theme of abortion. Therefore, the text does not present a stance on abortion, neither pro-life nor pro-choice."
ERS05E07,deepseek-v3,5,0,"The provided dialogues from the ER episode do not contain any direct or substantial discussion on the theme of abortion. While there is a brief mention of a character having had two abortions in their medical history, this is not explored in depth or debated among characters. The episode's focus is primarily on other medical and interpersonal issues, with no dominant position or discourse on abortion presented. Therefore, the text does not align strongly with either pro-life or pro-choice perspectives."
ERS05E07,gemini-2.5,1,-1,"The episode contains a significant subplot involving Carol Hathaway and a patient, Maria Jones, which directly addresses abortion. Maria, who has two sons and two prior abortions, feigns severe pain suggestive of an ectopic pregnancy. Her actual motive is revealed to be obtaining an ultrasound to determine the sex of the fetus (at 15 weeks), presumably to abort if it is female, as implied by her history and later comment ('Girls are trouble anyhow'). Carol reacts with visceral horror and anger upon realizing this, physically confronting the patient and challenging her intent, stating, 'Are you getting rid of this child...?' Maria asserts her autonomy ('It's my baby and I'll do what I want'), but her actions (deception) and inferred motive (sex selection) are framed negatively within the narrative. Carol, a main and generally sympathetic character, represents the opposition to *this specific* potential abortion, driven by the ethically questionable reason behind it. While her reaction is unprofessional, the emotional weight of the scene lies with her distress and condemnation of the patient's perceived callousness. The dialogue does not engage in a broad debate about abortion rights versus the moral status of the fetus in general terms. Instead, it focuses narrowly on the problematic ethics of abortion for sex selection. The dominant position presented through this conflict is critical of abortion when performed for reasons perceived as frivolous or discriminatory, leaning away from a neutral stance by portraying the character seeking the abortion negatively and the opposing character's emotional reaction (though flawed in execution) as understandable distress. This implicit disapproval of abortion under these specific circumstances, without making a universal pro-life argument, aligns with a moderately pro-life framing where the context significantly impacts the ethical judgment."
ERS05E07,gemini-2.5,2,0,"The episode's engagement with the theme of abortion is primarily concentrated in the storyline involving the patient Maria Jones. The dialogues present a distinct conflict between a patient asserting her reproductive autonomy and a healthcare provider reacting with strong personal disapproval. Maria Jones, who has a history of two previous abortions, fakes severe pain to obtain an ultrasound, seemingly to determine the sex of her 15-week fetus, stating a preference for a girl after having two boys. When confronted, she explicitly states, 'It's my baby and I'll do what I want,' firmly asserting her right to choose, potentially including termination based on gender preference (though the ultrasound was inconclusive, and her final remark, 'Girls are trouble anyhow,' adds cynical ambiguity). Nurse Carol Hathaway reacts with visceral anger and judgment, physically trying to stop Maria and condemning her potential decision, especially in light of her history and perceived flippant motivation ('Are you getting rid of this child...?'). This confrontation highlights opposing viewpoints: Maria's unqualified assertion of choice versus Carol's emotionally charged, implicitly pro-life reaction in this specific context. The narrative does not explicitly endorse either character's stance but presents the conflict itself. Maria ultimately leaves, seemingly free to pursue her choice, underscoring the reality of patient autonomy. However, the questionable circumstances (faking illness, potential sex selection, Maria's final remark) and Carol's profound distress prevent the scene from being a straightforward validation of the pro-choice position. The episode doesn't delve into broader ethical arguments about fetal moral status versus bodily autonomy but focuses intensely on this specific, ethically complex scenario. Because it presents both the assertion of choice and strong disapproval without definitively resolving the ethical tension or leaning heavily towards one side as a general principle, the dominant position is best characterized as Neutral / Balanced."
ERS05E07,gemini-2.5,3,-1,"The episode predominantly addresses abortion through a single, specific, and ethically charged storyline involving the character Maria Jones. Maria fakes symptoms of a potential ectopic pregnancy to obtain an ultrasound, seemingly to determine the sex of the fetus, having previously had two boys and two abortions. When confronted by Carol Hathaway, Maria asserts her autonomy ('It's my baby and I'll do what I want'), implying she may abort based on the sex, especially after remarking 'Girls are trouble anyhow' upon learning it might be a girl. Carol's reaction is visceral and condemnatory; she physically confronts Maria, questions her decision ('Are you getting rid of this child...?'), and expresses outrage after Maria leaves ('What's the matter with you?!').   The narrative frames this specific instance of abortion consideration—sex selection achieved through deception—in a strongly negative light. While Maria voices a pro-choice stance ('I'll do what I want'), her manipulative actions and seemingly callous motivation undermine this perspective within the story's context. Carol's emotional outburst dominates the scene, emphasizing the perceived moral wrongness of Maria's potential decision and actions, highlighting the value of the potential life in contrast to the reason for considering termination. The episode doesn't engage in a broad debate on abortion rights or fetal moral status in general, but focuses narrowly on this problematic scenario. The dominant position presented through Carol's reaction and the negative portrayal of Maria's choices leans towards a condemnation of *this specific* use of abortion, emphasizing the moral burden and ethical dubiousness of the choice under these circumstances, rather than supporting the individual's autonomy in this case. This aligns most closely with a moderately pro-life stance, where certain contexts make the choice ethically questionable or unacceptable, and the individual's reasons are scrutinized negatively."
ERS05E07,gemini-2.5,4,0,"The provided text features one significant plotline directly addressing abortion, centered around the patient Maria Jones. She presents with suspected ectopic pregnancy symptoms but is found to be 15 weeks pregnant with a potentially female fetus. Nurse Practitioner Carol Hathaway suspects Maria faked her symptoms to determine the fetus's sex, intending to abort if it's a girl, given her history (two boys, two previous abortions). Carol confronts Maria aggressively, expressing strong moral objection ('Are you gonna abort this baby?', 'Are you getting rid of this child...?'). Maria responds by asserting her autonomy ('It's my baby and I'll do what I want') and makes a comment implying a preference against having a girl ('Girls are trouble anyhow'). Another character intervenes, telling Carol to release Maria and later implicitly criticizes Carol's extreme reaction ('What's the matter with you?!').   The dominant position within this specific conflict is complex. Carol represents a strong, albeit situation-specific, anti-abortion stance, driven by the ethically charged reason of sex selection. Her intense emotional reaction and judgment dominate the interaction. However, her unprofessional behavior (physical confrontation, yelling) is negatively framed by another character's reaction, suggesting a critique of imposing judgment so forcefully. Maria voices a pro-autonomy stance, but her potential motivation (sex selection) and flippant final remark frame her position as ethically questionable within the narrative. The text doesn't present a defense of abortion rights in general or endorse either character's position outright. Instead, it uses a controversial scenario (sex-selective abortion) to highlight the intense emotions, ethical dilemmas, and conflicts surrounding abortion decisions, focusing on the specific problematic reason rather than the fundamental right. The narrative presents the conflict between judgment (Carol) and autonomy (Maria) but frames both the judgmental action and the potential reason for the abortion negatively. Therefore, the text examines the complexity without definitively favoring a general pro-life or pro-choice stance, presenting the scenario as an ethical quandary. This balanced portrayal of a specific, contentious issue aligns best with a neutral score."
ERS05E07,gemini-2.5,5,-1,"The episode presents a specific, emotionally charged scenario involving abortion rather than a broad debate. The central conflict regarding abortion occurs when Carol Hathaway discovers a patient, Maria Jones, may have faked severe pain to get an ultrasound, potentially to determine the fetus's sex before deciding whether to abort, having had two previous abortions after two live births (boys). Carol reacts with intense moral outrage, confronting Maria physically and verbally ('She's had two boys and two abortions. Are you getting rid of this child...?'). Maria defends her autonomy ('It's my baby and I'll do what I want'). Dr. Greene intervenes, telling Carol to let Maria go, upholding Maria's autonomy to leave but not validating her potential reasons. The narrative focus is heavily on Carol's visceral negative reaction and the ethically questionable context (potential gender selection, deception) surrounding Maria's potential choice. While Maria's right to choose is ultimately not physically impeded, the emotional weight and framing of the scene strongly highlight the perceived moral wrongness of *this specific* potential abortion, emphasizing the value of the fetus over the patient's stated (and potentially frivolous) reasons. Carol's own concurrent infertility struggles implicitly add weight to her perspective within the narrative. This focus on the disturbing context of the choice and the strong negative emotional reaction from a main character, while acknowledging the patient's autonomy exists, aligns the dominant position more closely with a moderately pro-life perspective."
ERS05E07,gpt-4o,1,0,"The episode's dialogues do not directly address the abortion topic until a scene involving a young woman, Maria Jones, who mentions a pregnancy with severe abdominal pain. It is later revealed that she had two prior abortions and is uncertain about her current pregnancy, causing tension when questioned by medical staff. The medical and emotional perspectives are primarily explored, with a focus on personal choice and the medical team's responsibility to ensure her health. There is some implicit judgment from a character who questions her decision-making and suggests she might abort again, which highlights a theme of individual choice versus societal expectations or judgments. However, this viewpoint is not dominant and does not overshadow the theme of choice. Overall, the episode leans slightly towards supporting the individual's autonomy regarding abortion, with multiple perspectives present and an acknowledgment of the complexity of the situation."
ERS05E07,gpt-4o,2,0,"The episode's dialogues contain diverse topics ranging from medical emergencies to personal interactions among characters, and only a brief mention of abortion. After evaluating the text, it is clear that abortion is not a dominant theme, and the mention of it occurs in a scene relating to a patient's medical record with past abortions and their current pregnancy. The conversation does not delve into ethical, social, or emotional arguments about abortion but rather focuses on the immediate medical situation. The mention of past abortions and speculating about the decision to potentially abort a current pregnancy lacks substantive ideological discourse regarding abortion rights or the moral status of the fetus. As a result, the text can be placed at 0 on the scale, indicating a neutral or balanced stance, given that it neither advocates for nor against abortion but treats the topic as a part of multiple dimensions in a medical dialogue."
ERS05E07,gpt-4o,3,1,"The dialogues provided from the ER episode do not prominently feature a discussion on the theme of abortion. However, there is a moment towards the end of the transcript where a character, Maria Jones, is briefly questioned about her decision regarding a pregnancy. This scene involves a character suspecting another of intending to have an abortion, focusing on the fact that she wanted to know the sex of the fetus. The character presses Maria on potential plans for abortion, but Maria asserts her autonomy over the decision, indicating she will make her own choice regarding her pregnancy. This exchange suggests a leaning towards respecting a pregnant individual's autonomy and choice, though it's not very explicit or detailed. The scene portrays Maria's decision as a personal right, slightly tilting towards a pro-choice stance, albeit within a context lacking depth in argumentation. Thus, the episode as a whole, given its minimal engagement with the topic, could be considered to have a moderate pro-choice lean."
ERS05E07,gpt-4o,4,0,"The provided dialogue from the ER episode contains numerous interactions among characters, largely revolving around their personal lives and medical cases. Abortion is mentioned in a couple of instances, primarily through Maria Jones' storyline. In this narrative, Maria expresses uncertainty about her pregnancy, and Carol confronts her with strong emotions over whether she plans to keep the baby or have an abortion. Maria asserts her autonomy by stating, 'It's my baby and I'll do what I want.' This exchange reflects a tension between pro-life concerns (Carol's emotional appeal against abortion) and pro-choice autonomy (Maria's assertion of the right to choose). However, there is no prevalent focus on the ethical debate around abortion throughout the text, nor are detailed discussions about its moral implications present. The narrative does not lean strongly towards either a pro-life or pro-choice standpoint but touches on aspects of individual choice and emotional reactions to the concept of abortion. Given these elements, the episode's dialogue maintains a balanced perspective, acknowledging individual choice amid emotional contexts without extensive moral argumentation."
