episode,model,attempt,score,detailed_evaluation
CMS02E09,deepseek-v3,1,0,"The episode's dialogues touch on various medical and personal issues, but the theme of abortion is only briefly mentioned in the context of April and Tate's discussion about potential risks to their baby due to April's TB medication. The dialogue does not strongly advocate for either a pro-life or pro-choice position but rather presents a personal and emotional conflict between the characters. The dominant position is not clearly pro-life or pro-choice, as the discussion is more about the characters' personal beliefs and fears rather than a broader ethical debate. Therefore, the text does not strongly align with either end of the scale."
CMS02E09,deepseek-v3,2,-2,"The episode's dialogues touch on various medical and personal issues, but the theme of abortion is only briefly mentioned in the context of April and Tate's discussion about their pregnancy. April, who is Catholic, firmly states that they are not terminating the pregnancy, despite concerns about the baby's health due to her TB medication. Tate expresses his desire to discuss the option, but the dominant position in the text is clearly against abortion, aligning with April's pro-life stance. The dialogue does not explore other perspectives on abortion in depth, focusing instead on the emotional and ethical considerations from a pro-life viewpoint."
CMS02E09,deepseek-v3,3,-1,"The episode's dialogues cover a wide range of medical and personal issues, but the theme of abortion is only briefly touched upon in a conversation between April and Tate. April, who is Catholic, firmly states her opposition to terminating the pregnancy, despite concerns about the baby's health due to her TB medication. Tate expresses his desire to discuss the option, but the conversation is cut short, and the dominant position within the text aligns with April's pro-life stance. The dialogue does not explore the topic in depth or present a balanced view, focusing instead on the emotional and ethical conflict between the characters."
CMS02E09,deepseek-v3,4,-2,"The episode's dialogues cover a wide range of medical and personal issues, but the theme of abortion is only briefly touched upon in a conversation between April and Tate. April, who is Catholic, firmly states her opposition to terminating the pregnancy, despite concerns about the potential effects of her TB medication on the baby. Tate expresses his desire to discuss the option, but the conversation is cut short, and the dominant position in the text aligns with April's pro-life stance. The dialogue does not explore other perspectives on abortion in depth, and the emotional and medical considerations are overshadowed by the moral imperative to preserve the pregnancy."
CMS02E09,deepseek-v3,5,-2,"The episode's dialogues cover a wide range of medical and personal issues, but the theme of abortion is only briefly touched upon in the conversation between April and Tate. April, who is Catholic, firmly states her opposition to terminating the pregnancy, despite concerns about the potential effects of her TB medication on the baby's development. Tate expresses his desire to discuss the option, but the dialogue clearly emphasizes April's pro-life stance, rooted in her religious beliefs. The conversation does not explore pro-choice arguments in depth, and the narrative does not present a balanced view on the topic. Instead, it aligns more closely with a pro-life perspective, particularly in how April's position is portrayed as definitive and morally grounded."
CMS02E09,gemini-2.5,1,-2,"The analysis focuses on the dialogue between April Kepner and Tate Jenkins concerning April's 12-week pregnancy. An ultrasound reveals a potential issue (low fetal measurement) possibly linked to April's necessary TB medication, raising concerns about anencephaly. Tate expresses worry about April's health and the potential quality of life for the baby, suggesting they need to 'understand' the implications and consider options, especially given the approaching 14-week mark which makes termination riskier and more complex. He explicitly states, 'If we're considering...' and asserts his stake ('It's my baby too. Don't I at least get to discuss this?'), indicating an openness to discussing termination based on medical and quality-of-life factors. However, April immediately and forcefully shuts down this line of discussion. She states, 'We're not,' invokes her Catholic faith ('Tate, I am Catholic.'), and declares definitively, 'We are not terminating this pregnancy.' April's position is absolute, prioritizing the continuation of the pregnancy based on religious conviction, overriding medical concerns or potential quality-of-life issues raised by Tate. While Tate introduces perspectives often associated with pro-choice arguments (mother's health, potential suffering of the child, practical timing), his viewpoint is given minimal space and is immediately rejected. The dominant position presented in the text is April's unwavering refusal to consider abortion, framing the fetus's continuation of life as non-negotiable, largely overshadowing Tate's concerns. This aligns the dominant discourse within this specific conflict strongly towards the pro-life end of the spectrum, where the moral imperative to protect fetal life overrides other considerations."
CMS02E09,gemini-2.5,2,-2,"The provided dialogues introduce the theme of abortion through the characters April Kepner and Tate Jenkins after they receive concerning news during April's 12-week ultrasound. The fetal measurements are low, raising concerns about potential developmental issues like anencephaly, possibly linked to April's necessary tuberculosis medication. Tate cautiously broaches the subject of 'considering' termination, highlighting the potential risks to April's health, the baby's quality of life, and the time sensitivity (before 14 weeks). He frames it as something that needs to be discussed, acknowledging his stake ('it's my baby too'). However, April's response is immediate and absolute: 'We're not.' She reinforces her stance by stating her religious identity ('Tate, I am Catholic') and firmly ends the conversation with 'We are not terminating this pregnancy.' While Tate introduces factors often central to pro-choice arguments (mother's health, quality of life, the need for discussion and choice), his perspective is quickly and decisively shut down by April. Her position, rooted in religious conviction, presents the continuation of the pregnancy as non-negotiable, effectively silencing further debate on termination within the provided text. The narrative foregrounds her refusal, making her pro-life stance the dominant one in this specific conflict. It acknowledges the complexity Tate raises but ultimately resolves the immediate discussion through April's unwavering opposition to abortion, aligning with a strongly pro-life viewpoint where the preservation of the pregnancy overrides other considerations raised."
CMS02E09,gemini-2.5,3,-2,"The provided dialogues contain a specific subplot involving April and Tate discussing their pregnancy after an ultrasound reveals potential complications (low fetal measurement, risk of anencephaly possibly linked to April's necessary TB medication). Tate raises the possibility of terminating the pregnancy, citing concerns for April's health and the potential quality of life for the baby, emphasizing the increasing risks after 14 weeks and his right to discuss it as the father. However, April immediately and firmly rejects this option ('We're not,' 'We are not terminating this pregnancy'), grounding her refusal in her religious beliefs ('Tate, I am Catholic'). While the dialogue presents both perspectives – Tate's concerns rooted in medical risk and quality of life, and April's absolute opposition based on faith – April's stance dominates the interaction and dictates its outcome within the scene. Her refusal prevents further discussion or exploration of the reasons Tate raises. The text showcases the conflict, but the weight and finality are given to the character holding the pro-life position, making her viewpoint the dominant one in this specific exchange. Tate's perspective, which might lean towards considering abortion under difficult medical circumstances (+1 on its own), is acknowledged but ultimately silenced and overruled by April's unwavering, faith-based opposition (-3 on its own). Considering the dynamic where the pro-life stance halts the conversation despite presented medical counterarguments, the dominant position within this text segment is strongly pro-life."
CMS02E09,gemini-2.5,4,-3,"The theme of abortion is addressed directly in one specific storyline involving April Sexton and Tate Jenkins following April's 12-week ultrasound. The ultrasound reveals a potential issue (low crown-chin length), raising concerns about fetal development (specifically mentioning anencephaly) potentially linked to April's necessary tuberculosis medication. Tate cautiously raises the possibility of termination, framing it as something that needs to be discussed given the potential health risks to April and the uncertain quality of life for the baby, mentioning the closing window for a less complicated procedure (before 14 weeks). April's reaction is immediate and absolute: she refuses to consider or even discuss termination ('We're not.', 'We are not terminating this pregnancy.'), explicitly grounding her stance in her Catholic faith. While Tate attempts to introduce medical context, potential quality of life issues, and his own parental stake ('It's my baby too. Don't I at least get to discuss this?'), April's religiously based conviction overrides these concerns entirely, shutting down the conversation. Her position treats the fetus's moral status as an absolute imperative, overshadowing medical considerations and Tate's perspective. Within this specific dialogue, April's stance is presented as final and non-negotiable. As this is the only explicit discussion of abortion in the provided text, April's unequivocal rejection of abortion, based on faith and overriding medical/contextual factors, constitutes the dominant position expressed on the topic."
CMS02E09,gemini-2.5,5,-2,"The dialogue segment concerning abortion centers around April's pregnancy, complicated by her need for TB medication and the detection of a potential fetal abnormality (low crown-chin length suggesting possible anencephaly). Tate raises the possibility of termination ('If we're considering...'), explicitly mentioning the potential impact on the baby's quality of life and the procedural implications of delaying the decision past 14 weeks. He frames it as a topic that needs discussion ('Don't I at least get to discuss this?'). However, April, citing her Catholic faith ('Tate, I am Catholic.'), immediately and firmly rejects the idea outright ('We are not terminating this pregnancy.'), shutting down any further discussion despite the medical concerns raised. While Tate introduces elements often considered in pro-choice or balanced arguments (medical necessity, potential quality of life, partner involvement in decision-making), his perspective is quickly and decisively overridden. April's position, rooted in religious conviction, presents the continuation of the pregnancy as non-negotiable, effectively prioritizing the preservation of potential life over the concerns about fetal health issues or even the possibility of discussion. The dominant stance within this exchange is therefore April's absolute refusal, which aligns with a strongly pro-life perspective where abortion is unacceptable regardless of the circumstances presented."
CMS02E09,gpt-4o,1,-1,"The episode's dialogue covers various interactions between characters that touch on personal relationships, medical cases, and social interactions. The theme of abortion is discussed in one particular dialogue where a character named April, who is pregnant, and her partner Tate converse about the potential risks to their baby's health due to medication April is taking for her TB. Tate brings up the idea of termination given the risk, but April firmly states she is Catholic and not considering abortion. The discussion briefly highlights the tension between potential health risks and personal beliefs, with a clear dominance of April's pro-life stance centered on her religious conviction. There is acknowledgment of fetal considerations and Tate expresses concern for the baby's quality of life, yet these do not override April's firm stance against abortion due to her beliefs. Other characters and dialogues in the episode do not greatly contribute to or contradict this dominant conversation surrounding abortion."
CMS02E09,gpt-4o,2,0,"The dialogue in the episode does mention the discussion of abortion between the characters April and Tate. The conversation reveals a conflict between Tate's willingness to at least consider abortion due to potential risk to April's health and the baby's quality of life, against April's firm stance as a Catholic to not terminate the pregnancy under any circumstance. However, this is just one part of a broader storyline and doesn't dominate the episode considerably. The rest of the episode focuses on various medical and personal dramas involving other characters. When factoring the representation of views: April holds a pro-life view due to her faith, while Tate expresses a more nuanced position that considers medical and personal circumstances, yet both perspectives appear within a short exchange and without a dominant reinforcement throughout the episode. Therefore, the dominant position in this episode leans towards 'Neutral / Balanced' since the theme of abortion is briefly touched upon and does not prominently sway towards pro-life or pro-choice."
CMS02E09,gpt-4o,3,-1,"The episode predominantly focuses on medical drama involving various characters, with limited direct discussion on the theme of abortion. However, when the topic of abortion is addressed, the most explicit dialogue involves April and Tate's discussion about a potential termination due to medical concerns about the fetus. April, who is Catholic, is adamantly opposed to the idea of terminating the pregnancy, stating, 'We are not terminating this pregnancy.' This indicates a strong personal conviction against abortion, driven by religious beliefs. Tate, on the other hand, appears open to discussing the possibility, considering the medical advice and potential risk to April's health and the baby's quality of life. Although there is an acknowledgment of medical and emotional considerations, April's firm stance suggests a moderately pro-life position, where the fetus's moral value is heavily weighted, but with some recognition of context. The overall portrayal does not highlight abortion as a fundamental right or prioritize personal autonomy over fetal concerns strongly enough to suggest a pro-choice alignment."
CMS02E09,gpt-4o,4,-1,"The episode does not heavily focus on the theme of abortion, but it does touch on it briefly during the scene with April and Tate discussing the possibility of terminating a pregnancy due to potential health risks. This scene suggests a complex emotional and ethical consideration regarding abortion. April's perspective is rooted in her Catholic beliefs, indicating a pro-life stance as she opposes termination. Tate, on the other hand, considers the health implications for April and the potential quality of life challenges for the baby, hinting at a more pro-choice perspective that takes into account the pregnant individual's circumstances and potential medical issues. However, the dialogue mainly revolves around April's decision against termination, which aligns closer to a moderately pro-life stance. Overall, this isn't the dominant theme of the episode, and the brief discussion doesn't allow for a strong emphasis or many different perspectives on abortion to be fully explored."
CMS02E09,gpt-4o,5,-1,"The episode's dialogues touch on various medical scenarios and personal interactions without a strong emphasis on the theme of abortion. However, one significant moment features a character named April who is pregnant and has a brief discussion with Tate about the potential risks to her health and their unborn child. April, being Catholic, firmly opposes termination, stating, 'We are not terminating this pregnancy.' Tate, who is concerned about the potential health risks and quality of life for their child, suggests discussing the option considering the circumstances, but the conversation doesn't progress beyond brief acknowledgment. This reflects a 'Moderately Pro-Life' stance as it acknowledges potential health concerns but ultimately emphasizes the importance of continuing the pregnancy due to personal and religious beliefs. Other parts of the episode, including numerous medical scenarios and personal relationships, do not address the theme of abortion, leaving the primary opinion shared as the dominant position."
CMS02E09,gpt-4o-mini,1,-2,"The dialogues primarily focus on the complexities of medical decisions and personal relationships, with a few references to pregnancy and possible health risks affecting the fetus. However, there is a notable scene where one character, April, asserts her refusal to consider terminating the pregnancy, emphasizing her religious beliefs. This conversation, along with the fact that medical concerns for the mother's health are recognized but ultimately overridden by a refusal to consider termination, leans significantly towards a pro-life perspective. The characters also express emotional and social dynamics surrounding pregnancy without offering a balanced discussion on the option of abortion, thus framing it as unacceptable. Therefore, the dominant position expressed across the dialogues is one that aligns closely with a strongly pro-life stance."
CMS02E09,gpt-4o-mini,2,-2,"In the provided dialogues, the theme of abortion arises primarily in the conversation between April and Tate. April, who is pregnant and is concerned about the potential health implications of her tuberculosis medication on the fetus, is adamantly opposed to terminating the pregnancy. Tate raises the possibility of considering termination if the baby's health is compromised, indicating a reluctance to engage in that discussion because of his partner's convictions; he states, 'we need to understand this gets riskier, more complicated after 14 weeks,' suggesting a sense of urgency and seriousness about the situation. However, April firmly states, 'we are not terminating this pregnancy,' which emphasizes her strong pro-life stance, further solidified by the fact that she identifies as Catholic. Their dialogue lacks acknowledgment of the complexity surrounding personal choice and circumstances, framing abortion as unacceptable. Therefore, the overall stance of the dialogues can be categorized as strongly pro-life, as emotional, social, and medical considerations surrounding abortion are presented with considerable bias towards the preservation of fetal life, overshadowing the pregnant individual's autonomy and choices."
CMS02E09,gpt-4o-mini,3,-2,"The dialogues presented offer a mix of perspectives regarding pregnancy and the implications of medical decisions stemming from health concerns. Notably, a clear conflict arises over the option of terminating a pregnancy when health risks to the mother or fetus are involved, reflecting differing views of the characters. One character expresses strong opposition to termination due to personal beliefs, indicating a pro-life stance. However, another character suggests exploring all options, which introduces a moderate recognition of the complexities surrounding the topic. The overwhelming sentiment against termination and the priority placed on the fetus's well-being suggest that the text leans towards a pro-life interpretation, while also acknowledging some emotional dimensions of the arguments. Overall, the dominant tone leans strongly in favor of preserving the pregnancy, positioning the dialogues at -2 on the scale, indicative of a strong pro-life stance with limited exploration of alternative viewpoints regarding bodily autonomy."
CMS02E09,gpt-4o-mini,4,-2,"The dialogues primarily focus on medical situations, interpersonal relationships, and personal struggles, but they also touch on pregnancy and potential concerns regarding maternal health. Specifically, there is a significant discussion between the characters about a pregnant character's health in relation to her tuberculosis medication, potential birth defects, and the implications for terminating the pregnancy if the health of the mother is at stake. The male character expresses a desire to at least discuss termination if the baby's health is compromised, while the pregnant character, whose values seem more influenced by her Catholic faith, firmly opposes even considering abortion. This reflects a clearly pro-life viewpoint. However, the situation introduces the possibility of discussing abortion in the context of maternal health which, while framed largely negatively, acknowledges a need for discussion. Despite this, the overwhelming resistance to termination leans the text's theme toward a pro-life stance, marked by a strong emotional and ethical burden placed on the characters with respect to the fetus's potential moral status and the complications arising from their circumstance."
CMS02E09,gpt-4o-mini,5,-2,"The dialogues from the episode primarily reflect a pro-life stance, especially evident in the conversation between April and Tate regarding the potential risks to their baby's health due to April's TB medications. Tate expresses significant concern about the future and insists on not discussing the option of terminating the pregnancy, stating emphatically that they are not terminating. The concern for the fetus is paramount, overshadowing any consideration of abortion despite the health issues raised. Although the characters acknowledge the medical situation and its complications, the emotional and ethical context around a possible termination is not deeply explored or considered as a viable option, leading to a clearly pro-life theme throughout these exchanges."
CMS02E16,deepseek-v3,1,-2,"The episode presents a complex and nuanced view on abortion, primarily through the storyline of Teresa Azen, a woman in a persistent vegetative state who is discovered to be pregnant due to sexual assault. Her parents decide to keep the pregnancy despite the high medical risks, emphasizing the baby as 'the only part we have left' of their daughter. This narrative leans towards a pro-life perspective, as it highlights the moral and emotional value placed on the fetus, even in extremely difficult circumstances. However, the medical professionals express concerns about the risks to Teresa's health, introducing some pro-choice considerations regarding the pregnant individual's well-being. The overall narrative, however, is dominated by the parents' decision to prioritize the fetus's life, aligning more closely with a pro-life stance."
CMS02E16,deepseek-v3,2,0,"The episode presents a complex and nuanced view on abortion, primarily through the case of Teresa Azen, a woman in a persistent vegetative state who is discovered to be pregnant due to sexual assault. Her parents decide to keep the pregnancy despite the high medical risks to Teresa, citing the baby as 'the only part we have left' of their daughter. The medical team, while acknowledging the parents' wishes, emphasizes the severe risks to Teresa's health and survival, suggesting termination as a medically advisable option. This scenario highlights the tension between pro-life and pro-choice perspectives, with the parents leaning towards a pro-life stance (valuing the potential life of the fetus) and the medical team advocating for a pro-choice consideration (prioritizing Teresa's health and well-being). The narrative does not definitively side with either perspective but presents both arguments with empathy and depth, acknowledging the emotional, ethical, and medical complexities involved. Other subplots in the episode, such as the struggles of other patients and their families, further underscore themes of autonomy, care, and difficult decisions in medical contexts, but the Teresa storyline is the most directly relevant to the abortion discourse. Overall, the episode maintains a balanced approach, giving weight to both the moral considerations of fetal life and the rights and health of the pregnant individual."
CMS02E16,deepseek-v3,3,0,"The episode presents a complex narrative involving multiple medical and ethical dilemmas, including the case of Teresa, a woman in a persistent vegetative state who is discovered to be pregnant after being sexually assaulted. Her parents decide to keep the baby despite the high risks to Teresa's health, emphasizing the fetus's moral value and their emotional connection to it as 'the only part we have left' of their daughter. The medical professionals, while acknowledging the parents' wishes, highlight the severe health risks and ethical concerns, suggesting termination as a medically advisable option. The narrative does not definitively favor either pro-life or pro-choice perspectives but explores the tensions between fetal moral status, parental autonomy, and the pregnant individual's well-being. The resolution involves discovering Teresa's locked-in syndrome, allowing her to communicate her wishes, which shifts the focus to her autonomy. This nuanced portrayal, balancing emotional, ethical, and medical considerations without a clear dominant stance, aligns with a neutral or balanced position on the abortion discourse."
